{"action":"revoke_calibration","authority_effect":"candidate_calibration_control_only","authority_source":"ADR-0039 rollback demonstration","control_hash":"sha256:4e52cdd1cac24d4bf24f6e3d77c269902081f4df69acf2b8aaf10cb1f74b38ff","control_id":"17966281-69dd-5900-a8dd-feea2e653c4b","control_version":"1.0.0","decided_at":"2026-08-03T15:45:00Z","decided_by":{"authority_name":"thomasverburgt","authority_role":"project_owner"},"designation":"SPEC-DEPS","effects":{"a100_production_authorized":false,"candidate_discovery_enabled":false,"deployment_authorized":false,"dispatch_enabled":false,"packet_export_enabled":false,"product_fan_in_eligible":false,"report_eligible":false,"scheduled":false},"manifest_hash":"sha256:7d5d61c57d5c2f9d1e3a2efed5596f999e41b33e2d0014f5f33e1fb42e4caa90","manifest_id":"3bf87306-6e8e-5e55-ad88-8c53db6128d4"}
